{
  "artifact_count": 651,
  "classification_version": "2026.08",
  "artifacts": [
    {
      "owner": "za_local_compatibility",
      "path": ".editorconfig",
      "reason": "Temporary compatibility or repository-level artifact",
      "sha256": "166781bbf1b00bc87bcd6ceff068fcb83a97a1e98e3ec84dc5db311c676f6cb2"
    },
    {
      "owner": "za_local_compatibility",
      "path": ".eslintrc",
      "reason": "Temporary compatibility or repository-level artifact",
      "sha256": "931fd0f726fbde9e06ab46c948424ab7ad2c28db35ff83d6a87f20be40348dcb"
    },
    {
      "owner": "za_local_compatibility",
      "path": ".github/helper/install.sh",
      "reason": "Temporary compatibility or repository-level artifact",
      "sha256": "e01e3745cd00ae4408e22ea876376775a90424f4e8ae073909f07e3f5b488df4"
    },
    {
      "owner": "za_local_compatibility",
      "path": ".github/helper/site_config.json",
      "reason": "Temporary compatibility or repository-level artifact",
      "sha256": "5340d358be734a2992b83ffeee332ebb4e67dc17481a56476923c4f68947ac32"
    },
    {
      "owner": "za_local_compatibility",
      "path": ".github/workflows/ci.yml",
      "reason": "Temporary compatibility or repository-level artifact",
      "sha256": "282faa8ee7968d9cb9371dfca423891eb0f9cf88b5ccb6ae3d22b4f879829093"
    },
    {
      "owner": "za_local_compatibility",
      "path": ".gitignore",
      "reason": "Temporary compatibility or repository-level artifact",
      "sha256": "344aca0ef8eb0e96d9bb03c8711e8ab97565e64b2a6edba4de809b54f0e41c3f"
    },
    {
      "owner": "za_local_compatibility",
      "path": ".pre-commit-config.yaml",
      "reason": "Temporary compatibility or repository-level artifact",
      "sha256": "3554f557dd50c98cb0605bad7be8f4790363f8a305d4f6ac9c9cb19106bc3296"
    },
    {
      "owner": "za_local_compatibility",
      "path": "README.md",
      "reason": "Temporary compatibility or repository-level artifact",
      "sha256": "d378355cafadbab00211fc672586c5d5f7b0e8ea480b0649f9a342c97bb8b1b6"
    },
    {
      "owner": "za_local_compatibility",
      "path": "TESTING.md",
      "reason": "Temporary compatibility or repository-level artifact",
      "sha256": "c39ee157ff4e4b5175963b2e1aec43a347795582805c975aeddc7a6251236c54"
    },
    {
      "owner": "za_local_core",
      "path": "docs/annual_statutory_rate_update.md",
      "reason": "Shared practitioner content",
      "sha256": "d6eaaa044ff868087bfeabe35b7f66f7b80afe5c1bcb0f047d9f010bb49a82eb"
    },
    {
      "owner": "za_local_core",
      "path": "docs/practitioners_guide.md",
      "reason": "Shared practitioner content",
      "sha256": "b6a078fba06ea9f8e1ac6fa01c2397ebfbfcb15294a1a6725da9fd30c943f7d8"
    },
    {
      "owner": "za_local_workplace",
      "path": "docs/sa_coida_configuration_and_testing.md",
      "reason": "Workplace practitioner content",
      "sha256": "2ee75fef3cce77a1d073671ac562f0f9f415a2d82c889f393e1ceded0bd47723"
    },
    {
      "owner": "za_local_workplace",
      "path": "docs/sa_labour_configuration_and_testing.md",
      "reason": "Workplace practitioner content",
      "sha256": "51cc9f9898b49763c7e7334242382aa24d8074457cd1e34a97e79fb2bd5484b0"
    },
    {
      "owner": "za_local_core",
      "path": "docs/sa_overview_setup_practitioner_guide.md",
      "reason": "Shared practitioner content",
      "sha256": "e57208cc13f2ebbde5bb5f367b1478c6db19cbf82ec43fcca27ca4e6f61b3e18"
    },
    {
      "owner": "za_local_payroll",
      "path": "docs/sa_payroll_compliance_remediation_2026_27.md",
      "reason": "Payroll practitioner content",
      "sha256": "63bb1cd75e0fbf3f822b00f3db0730e4d7508ff874f55ea0afd71f115f35a8e7"
    },
    {
      "owner": "za_local_payroll",
      "path": "docs/sa_payroll_configuration_and_testing.md",
      "reason": "Payroll practitioner content",
      "sha256": "e05d87cf02251fff050a2d8f884da2aeae0ebc6dd8d7f681f8cfb586e698ffb0"
    },
    {
      "owner": "za_local_finance",
      "path": "docs/sa_vat_configuration_and_testing.md",
      "reason": "Finance practitioner content",
      "sha256": "e60bfe92cbe9908e9f1f093086e611f7e951a177e8b9bb1996feab7972a4af0e"
    },
    {
      "owner": "za_local_compatibility",
      "path": "license.txt",
      "reason": "Temporary compatibility or repository-level artifact",
      "sha256": "002c2696d92b5c8cf956c11072baa58eaf9f6ade995c031ea635c6a1ee342ad1"
    },
    {
      "owner": "za_local_compatibility",
      "path": "pyproject.toml",
      "reason": "Temporary compatibility or repository-level artifact",
      "sha256": "00b990d9b5e527b1973bf40d91ba859a34ade9c615598ecec775cf8c7cf767b7"
    },
    {
      "owner": "za_local_core",
      "path": "za_local/__init__.py",
      "reason": "Legacy composition artifact owned by the core migration programme",
      "sha256": "99e0be1541fd81306eb9e20def5c0faad4d279755b85ddce0cd86cbefc211e63"
    },
    {
      "owner": "za_local_finance",
      "path": "za_local/accounts/__init__.py",
      "reason": "South African accounting setup",
      "sha256": "c91e6d65b00f112e4dc7e623f2eff59e6bf50cde259a6a1da621164c330cefae"
    },
    {
      "owner": "za_local_finance",
      "path": "za_local/accounts/chart_of_accounts/__init__.py",
      "reason": "South African accounting setup",
      "sha256": "c38ea112b66844bf16aff577dc25d15a42e93314ccadc3398df78fde1100a550"
    },
    {
      "owner": "za_local_finance",
      "path": "za_local/accounts/chart_of_accounts/za_south_africa_chart_template.json",
      "reason": "South African accounting setup",
      "sha256": "9ec1846c089ea341cd30784ab2e87274a09c025149e6b66cce1a153935e47e57"
    },
    {
      "owner": "za_local_finance",
      "path": "za_local/accounts/setup_chart.py",
      "reason": "South African accounting setup",
      "sha256": "e9a2353f353c537b8c1a7d1eeeb5fe23b1b8dc4cc4179b902a2278ca32d88c01"
    },
    {
      "owner": "za_local_core",
      "path": "za_local/api/__init__.py",
      "reason": "Shared application APIs",
      "sha256": "6a615cf518ed71b74c84a381872b52141f812c8d462c86db16703537ab28e229"
    },
    {
      "owner": "za_local_core",
      "path": "za_local/config/__init__.py",
      "reason": "Shared navigation configuration",
      "sha256": "e3b0c44298fc1c149afbf4c8996fb92427ae41e4649b934ca495991b7852b855"
    },
    {
      "owner": "za_local_workplace",
      "path": "za_local/config/sa_coida.py",
      "reason": "Workplace navigation configuration",
      "sha256": "117f9cd5ce9a71688909da71095e325454e6bf327edf0bc2e629cc361565d8ab"
    },
    {
      "owner": "za_local_workplace",
      "path": "za_local/config/sa_labour.py",
      "reason": "Workplace navigation configuration",
      "sha256": "ddad579d821406b73ed5fb5ca19d4455d2002a6bb63ecd1e4232056235898bc2"
    },
    {
      "owner": "za_local_payroll",
      "path": "za_local/config/sa_payroll.py",
      "reason": "Payroll navigation configuration",
      "sha256": "bb782e9fc2ff302c8fe0801aa1956b1a11d3224e6ebcc86b2ee3ba94355efc71"
    },
    {
      "owner": "za_local_core",
      "path": "za_local/config/sa_setup.py",
      "reason": "Shared navigation configuration",
      "sha256": "500d36662161281a5ac753fc062301a49781b67d1fe44acc6c8b9f4892dae3fc"
    },
    {
      "owner": "za_local_finance",
      "path": "za_local/config/sa_vat.py",
      "reason": "Finance navigation configuration",
      "sha256": "7bcc70b2a5cd5d952502635c1101aa0a8f7ef9dddac4d5d7fbdf210b0ddc5b92"
    },
    {
      "owner": "za_local_finance",
      "path": "za_local/custom/__init__.py",
      "reason": "Finance master and transaction extensions",
      "sha256": "c8750e753c35588773cbc1be6305859c1a6475735704ac96d04791193d293f27"
    },
    {
      "owner": "za_local_finance",
      "path": "za_local/custom/customer.py",
      "reason": "Finance master and transaction extensions",
      "sha256": "38719ba79ed94c250113123dfffb5be1c1ba873979c4bdadfbce0caf84d71702"
    },
    {
      "owner": "za_local_finance",
      "path": "za_local/custom/purchase.py",
      "reason": "Finance master and transaction extensions",
      "sha256": "f32ee52eac6d3e75f1fc4fca1f8d8468bacecb88a7e7aa6f5484d0fecbe7caa1"
    },
    {
      "owner": "za_local_finance",
      "path": "za_local/custom/sales.py",
      "reason": "Finance master and transaction extensions",
      "sha256": "ebbd35555b23975eb21293dc4cf5a3675469075d3297fa0b9c760704caf90e97"
    },
    {
      "owner": "za_local_workplace",
      "path": "za_local/data/bargaining_council_list.csv",
      "reason": "Workplace reference data",
      "sha256": "877668e1af44b4c9380c225a07a6baab86974bc03680d1d5be8ec208b66bd99f"
    },
    {
      "owner": "za_local_workplace",
      "path": "za_local/data/business_trip_region.csv",
      "reason": "Workplace reference data",
      "sha256": "147417fc52c635bb0fd21c312fe467ee62d06bf233d06ebb072b4c13a5e592fc"
    },
    {
      "owner": "za_local_workplace",
      "path": "za_local/data/seta_list.csv",
      "reason": "Workplace reference data",
      "sha256": "dff145cd2fb98ea99fa36442c63ff535f50104a4d891a2144e1fd7469017b8f3"
    },
    {
      "owner": "za_local_workplace",
      "path": "za_local/desktop_icon/sa_coida.json",
      "reason": "Workplace public asset",
      "sha256": "f0bea5ca29cb7a21e51133b32dccbfe3fa4917e26d3ec72041ccc8b903f5b31d"
    },
    {
      "owner": "za_local_workplace",
      "path": "za_local/desktop_icon/sa_labour.json",
      "reason": "Workplace public asset",
      "sha256": "21f527b6c2dacb838e8cfc2c42d7b1bd043f0fd540ce105a4380887cef3ec078"
    },
    {
      "owner": "za_local_core",
      "path": "za_local/desktop_icon/sa_localisation.json",
      "reason": "Shared localisation public asset",
      "sha256": "030a0cf9358cb6b9b93000fed5e3ef45cd0159b4ff8aaecc9fa2eb3d8d2f2006"
    },
    {
      "owner": "za_local_payroll",
      "path": "za_local/desktop_icon/sa_payroll.json",
      "reason": "Payroll public asset",